day;theme;title;introduction;main_content;vocabulary_focus;noun_focus;grammar_focus;grammar_data_focus;review_content;estimated_time;difficulty_level;success_criteria;hints;fun_facts;cultural_highlight;motivational_note
1;Greetings & Formalities;The First Conversation;Welcome to Day 1! This is the most crucial lesson for making a great first impression. We will dive deep into the essential greetings and the non-negotiable cultural rule of formal vs. informal address.;"**80/20 Focus:** Mastering `Guten Tag`, `Danke`, `Bitte`, and knowing when to use `Sie` will navigate you through 80% of your first polite interactions. This is the absolute foundation.\n\n**1. Detailed Greetings by Time:**\n* `Guten Morgen` (Good Morning): Use from waking up until about 10-11 AM. A simple `Morgen!` is common among colleagues or friends.\n* `Guten Tag` (Good Day): The universal, polite greeting from ~11 AM until evening (~6 PM). It is never wrong during the daytime. A casual version is `Tag!`.\n* `Guten Abend` (Good Evening): Used from ~6 PM onwards. A casual `Abend!` is also possible.\n* `Hallo` is a universal, more casual 'hello', perfect for peers.\n* `Tschüss` (Bye) is the standard friendly goodbye. `Auf Wiedersehen` is more formal (literally 'until we see again') and is common in shops.\n\n**2. The Concept of Sie vs. du (Critical):**\nThis is a fundamental cultural rule. Getting it wrong can be seen as disrespectful.\n* **Sie (formal 'you'):** Use with anyone you don't know, people older than you, in shops, restaurants, government offices, and any business context. The verb is always conjugated in the 3rd person plural form.\n  - `Wie heißen Sie?` (What is your name?)\n  - `Können Sie mir helfen?` (Can you help me?)\n* **du (informal 'you'):** Use with friends, family members, people your age in a casual setting, and children.\n  - `Wie heißt du?` (What is your name?)\n  - `Kannst du mir helfen?` (Can you help me?)\n\n**Watch Out!** Never use `du` with a police officer, a government official, or your boss (unless they explicitly invite you to).\n\n**Key Vocabulary:**\n| German | English | Usage Note |\n|---|---|---|\n| die Entschuldigung | excuse me / sorry | Use to get attention or to apologize.|\n| danke (schön/sehr) | thank you (very much) | |\n| bitte (schön/sehr) | please / you're welcome | The universal response to `danke`.|\n| ja / nein | yes / no | |\n| vielleicht | maybe | |";V001-V005;N014,N043;G001;;;30;1;"You can greet and say goodbye formally and informally, and explain why you would use 'Sie' with a shopkeeper.";The verb for formal 'Sie' is always the same as the infinitive form (e.g., `kommen` -> `Sie kommen`). This is an easy way to sound polite even if you don't know the full conjugation yet.;The German word for 'glove' is 'Handschuh', which literally translates to 'hand shoe'. German is famous for these logical (and sometimes funny) compound nouns.;In Germany, you wait to be invited to use 'du'. Someone of higher status or age will typically offer it by saying, ""Wir können uns duzen"" (We can say 'du' to each other). When in doubt, always start with 'Sie'.;You've just learned the most important rule of German politeness. This knowledge is more valuable than knowing 50 words. Well done!
2;Identity & Core Verbs;Who Am I? Who Are You?;Today's lesson is the key to describing existence. We'll master the two most important verbs in the German language: `sein` (to be) and `haben` (to have). They are completely irregular, but they are so frequent that learning them by heart is non-negotiable.;"**80/20 Focus:** Knowing `ich bin` (I am), `er/sie/es ist` (he/she/it is), `ich habe` (I have), and `er/sie/es hat` (he/she/it has) will allow you to form basic descriptive sentences about yourself, others, and what you possess.\n\n**1. The Verb `sein` (to be) - Irregular Conjugation:**\n`sein` is used for identity, characteristics, and location. It must be memorized perfectly.\n| Pronoun | `sein` | Example |\n|---|---|---|\n| ich | **bin** | Ich bin aus Deutschland. |\n| du | **bist** | Du bist Student. |\n| er/sie/es | **ist** | Sie ist Ärztin. |\n| wir | **sind** | Wir sind hier. |\n| ihr | **seid** | Ihr seid nett. |\n| sie/Sie | **sind** | Sie sind pünktlich. |\n\n**2. The Verb `haben` (to have) - Irregular Conjugation:**\n`haben` is used for possession and for certain fixed expressions.\n| Pronoun | `haben` | Example |\n|---|---|---|\n| ich | **habe** | Ich habe ein Auto. |\n| du | **hast** | Du hast Zeit. |\n| er/sie/es | **hat** | Er hat eine Frage. |\n| wir | **haben** | Wir haben Durst. |\n| ihr | **habt** | Habt ihr Geld? |\n| sie/Sie | **haben** | Sie haben Glück. |\n\n**Watch Out!** A very common mistake is to translate ""I am hungry"" as ""Ich bin hungrig"". While technically correct, 99% of Germans will say `Ich habe Hunger.` (I have hunger). The same applies to `Durst` (thirst).";V006,V012,V016;N011,N266,N267;G008;;Day 1;35;2;"You can conjugate 'sein' and 'haben' for all pronouns from memory and use them in sentences to describe states and possessions.";The `wir sind` and `sie/Sie sind` forms of 'sein' are identical. Likewise, `wir haben` and `sie/Sie haben` are identical and match the infinitive. Use this to simplify your learning!;The German expression for ""I am hungry"" is `Ich habe Hunger` (I have hunger). The same applies to thirst: `Ich habe Durst`. You *possess* hunger and thirst, you are not defined by them.;In Germany, when someone sneezes, you say `Gesundheit!` which literally means 'Health!'. It's a way of wishing them well and is considered polite.;Mastering 'sein' and 'haben' is like getting the keys to the kingdom. You will use them in almost every conversation from now on. Don't just learn them, *know* them.
3;Nouns & The Nominative Case;The World of Der, Die, Das;Every German noun has a gender: Masculine, Feminine, or Neuter. This gender is a grammatical property that you must memorize with the noun. It determines the form of the articles ('the', 'a/an') that accompany it. Today we focus on the Nominative case, the case for the subject of a sentence.;"**80/20 Focus:** Do not try to find logic in the gender of objects. Instead, always learn the noun *with* its article as a single vocabulary item (e.g., learn 'der Tisch', not just 'Tisch').\n\n**1. Grammatical Gender & Definite Articles (`the`):**\n| Gender | Article | Example |\n|---|---|---|\n| Masculine | **der** | `der Stuhl` (the chair) |\n| Feminine | **die** | `die Lampe` (the lamp) |\n| Neuter | **das** | `das Buch` (the book) |\n\n**2. The Nominative Case (The Subject):**\nThe Nominative case answers the question `Wer oder Was?` (Who or What?) is doing the action.\n* `Der Hund` bellt. (The dog barks.) -> **Wer** bellt? `Der Hund`.\n* `Das Auto` ist schnell. (The car is fast.) -> **Was** ist schnell? `Das Auto`.\n\n**3. Indefinite Articles (`a/an`) in the Nominative:**\n* Masculine: `ein` -> `Das ist ein Tisch.`\n* Feminine: `eine` -> `Das ist eine Tasse.`\n* Neuter: `ein` -> `Das ist ein Fenster.`\n\n**Watch Out!** Masculine and Neuter indefinite articles are the same (`ein`). You can only tell the noun's true gender if you have memorized it or see the definite article (`der`/`das`).";N002,N003,N004,N035;G003,G004;;Day 2;35;2;"You can correctly assign 'der/die/das' and 'ein/eine' to a list of common nouns and explain that the Nominative case is used for the subject.";Nouns ending in `-ung` (die Rechnung), `-heit` (die Freiheit), `-keit` (die Möglichkeit), `-schaft` (die Freundschaft), `-ei` (die Bäckerei) are almost always feminine (`die`). This is a very reliable shortcut!;The word `das Mädchen` (the girl) is neuter, not feminine. This is because the `-chen` suffix, which means 'little', automatically makes any noun neuter. So she is grammatically a 'little maid'.;The gender of a noun has nothing to do with the physical properties of the object itself. It's a purely grammatical concept. A chair is masculine, a lamp is feminine, and a girl is neuter. Accept it and move on!;This might seem strange now, but soon 'der, die, das' will feel completely natural to you. Every learner goes through this phase of confusion.
4;Regular Verbs;Putting a Sentence in Motion;Today we learn the blueprint for the vast majority of German verbs. By learning the standard conjugation pattern for regular ('weak') verbs, you unlock the ability to talk about thousands of actions in the present tense.;"**80/20 Focus:** The endings for `ich` (-e), `du` (-st), and `er/sie/es` (-t) are the most common in conversation. Master these first, as they show the most variation.\n\n**The Regular Verb Conjugation Pattern:**\nAll regular verbs follow a simple two-step process in the present tense:\n1.  **Find the stem:** Drop the `-en` ending from the infinitive verb. (e.g., `lernen` -> `lern-`, `machen` -> `mach-`)\n2.  **Add the correct personal ending:**\n| Pronoun | Ending | Example (`wohnen`) |\n|---|---|---|\n| ich | **-e** | ich wohn**e** in Berlin. |\n| du | **-st** | du wohn**st** in Berlin. |\n| er/sie/es | **-t** | er wohn**t** in Berlin. |\n| wir | **-en** | wir wohn**en** in Berlin. |\n| ihr | **-t** | ihr wohn**t** in Berlin. |\n| sie/Sie | **-en** | sie wohn**en** in Berlin. |\n\n**Watch Out! (Spelling Exception):**\nIf the verb stem ends in `-d` or `-t` (like `arbeiten` -> `arbeit-`), you must add an extra `-e-` before the `-st` and `-t` endings to make it pronounceable.\n* `du arbeitest` (NOT `arbeitst`)\n* `er arbeitet` (NOT `arbeitt`)";V008,V009,V018;;G005;;Day 3;35;2;"You can conjugate any regular verb, including those with stems ending in -t or -d, for all personal pronouns.";Chant the endings like a rhythm: **E - ST - T - EN - T - EN**. Say it ten times. It's the heartbeat of German verbs!;Many German verbs have been adopted into English. For example, `googeln` (to Google) conjugates as `ich google`, `du googelst`, `er googelt`. Other examples include `downloaden` and `chatten`.;The `ihr` form (`ihr wohnt`) is used when speaking to a group of people you know well (friends, children). It's the plural of `du`.;You've just learned a pattern that applies to thousands of verbs. This is a massive leap forward in your ability to communicate!
5;Sentence Structure;The Golden Rule: Verb at Position 2;This is the most important rule for building German sentences. In a simple statement (not a question), the conjugated verb is the anchor that always holds the second position. Master this, and your sentences will immediately sound structured and correct.;"**80/20 Focus:** For simple statements, always think: **Subject - Verb - Other stuff**. This basic structure (`Ich lerne Deutsch`) is your foundation. But also practice inverting it: **Time - Verb - Subject - Other stuff** (`Heute lerne ich Deutsch`).\n\n**The V2 (Verb-Second) Rule Explained in Detail:**\nThe 'second position' does not mean the second word, but the second 'idea' or 'element' in the sentence.\n* **Element 1: Subject**\n  - `Ich` (Pos 1) `gehe` (Pos 2) `heute ins Kino.` (I am going to the cinema today.)\n* **Element 1: Time**\n  - `Heute` (Pos 1) `gehe` (Pos 2) `ich ins Kino.` (Today I am going to the cinema.)\n* **Element 1: Place**\n  - `In Deutschland` (Pos 1) `spricht` (Pos 2) `man Deutsch.` (In Germany, one speaks German.)\n* **Element 1: Manner**\n  - `Gern` (Pos 1) `spiele` (Pos 2) `ich Tennis.` (I like to play tennis.)\n\n**Watch Out!** When an element other than the subject is in Position 1, the subject MUST move to come directly after the verb (Position 3). This is called **inversion**.";V011,V017;N005,N006;G002;;Day 4;30;3;"You can create sentences starting with a subject, a time phrase, or a place, and correctly place both the verb and the subject.";Think of the sentence as a train. The engine (the conjugated verb) is *always* the second car. You can change the first car (subject, time, place), but the engine's position is fixed.;Because of the strict V2 rule and the case system, German word order can be much more flexible than English. You can move parts of the sentence around to create different emphasis, which is a powerful tool in storytelling.;The V2 rule applies to statements. It changes for questions (verb moves to position 1) and in dependent clauses (verb moves to the end). But for now, cement this rule in your mind.;This is a grammar superpower. If you get the V2 rule right, Germans will understand you even if you make mistakes with articles or endings. It provides the core structure.
6;The Accusative Case;The Direct Object;When a noun is the direct recipient of an action (the 'direct object'), it goes into the Accusative case. This is our first case change, and it's the most common one you'll use. It answers the question `Wen oder Was?` (Whom or What?).;"**80/20 Focus:** The only article that changes is the **masculine** one. `der` becomes `den`. `ein` becomes `einen`. `kein` becomes `keinen`. Memorizing this single change is 80% of the work for this case.\n\n**The Accusative Case Declension:**\nTo find the direct object, ask ""Who or what is being 'verbed'?""\n| Gender | Nominative (Subject) | Accusative (Direct Object) | Example |\n|---|---|---|---|\n| Masculine | **der** Stuhl / **ein** Stuhl | **den** Stuhl / **einen** Stuhl | Ich kaufe **den** Stuhl. |\n| Feminine | **die** Lampe / **eine** Lampe | **die** Lampe / **eine** Lampe | Ich sehe **die** Lampe. |\n| Neuter | **das** Buch / **ein** Buch | **das** Buch / **ein** Buch | Ich lese **ein** Buch. |\n\n**Common Verbs that take an Accusative Object:**\n`haben` (to have), `sehen` (to see), `kaufen` (to buy), `lesen` (to read), `essen` (to eat), `trinken` (to drink), `brauchen` (to need), `suchen` (to look for), `finden` (to find).";V012;N007,N008;G006;;Day 5;30;3;"You can identify the direct object and apply the masculine accusative change for definite, indefinite, and negative articles.";Remember the 'N' for accusative: only the masculi**N**e article gets an **N** at the e**N**d of 'de**n**' / 'eine**n**' / 'keine**n**'.;English still has remnants of the accusative case in its pronouns: we say 'He sees me' (not 'I'), and 'I see him' (not 'he'). You've been using cases your whole life without thinking about it!;The accusative case is crucial for talking about what you have, see, buy, read, eat, or drink. It's one of the most common cases in daily conversation.;Don't be intimidated by the word 'case'. For now, it's just one simple change: `der` to `den`. You can handle that! It's a small change with a big impact.
7;Asking Questions;Getting the Information You Need;Let's learn how to ask for information. There are two fundamental types of questions in German, and both have simple, predictable structures based on the V2 rule we already know.;"**80/20 Focus:** Learn `Wer?` (Who?), `Was?` (What?), `Wo?` (Where?), and `Wie?` (How?). These four 'W-Fragen' will allow you to ask most of the important questions as a beginner.\n\n**1. W-Fragen (Information Questions):**\nThese use a question word (most start with 'W'). The verb stays in Position 2.\n**Structure: W-Word (Pos 1) + Verb (Pos 2) + Subject + ...**\n* `Wo ist der Bahnhof?` (Where is the train station?)\n* `Was machst du heute?` (What are you doing today?)\n* `Wer bist du?` (Who are you?)\n* `Wie heißt du?` (What is your name? lit. How are you called?)\n* `Wann beginnt der Film?` (When does the film begin?)\n\n**2. Ja/Nein Fragen (Yes/No Questions):**\nThese are questions that can be answered with 'yes' or 'no'. The verb moves to the front.\n**Structure: Verb (Pos 1) + Subject + ...**\n* `Lernst du Deutsch?` (Are you learning German?)\n* `Ist das ein Tisch?` (Is that a table?)\n* `Haben Sie Zeit?` (Do you have time?)";V013,V014,V015;;G014,G015;;Day 6;30;2;"You can correctly form both a W-Frage (with the verb in Pos 2) and a Ja/Nein Frage (with the verb in Pos 1).";For Yes/No questions, the verb is so excited to ask, it jumps to the very front of the line! For W-Fragen, the verb stubbornly stays in its favorite spot, Position 2.;The German word for 'why' is `warum`. A common, slightly informal way to answer is with `darum`, which literally means 'therefore' but is used like 'just because!' It's a bit cheeky.;Asking questions is a learning superpower. It allows you to control the conversation and get the information you need to understand the world around you. Don't be afraid to ask!;You're now moving from just making statements to having real, two-way conversations. This is a massive step in your language journey!
8;Negation;The Power of 'No';Saying 'no' is just as important as saying 'yes'. German has two main words for negation: `nicht` and `kein`. Learning which one to use is a simple but critical rule that will make your language much more precise.;"**80/20 Focus:** Use `kein` for nouns that could have 'a/an' (ein/eine) in front of them. Use `nicht` for everything else (verbs, adjectives, specific nouns).\n\n**1. Using `kein` (not a / no / not any):**\n`kein` is a **negative article**. It is used to negate a noun that is indefinite (i.e., has no article or an indefinite article).\n* `Ich habe einen Hund.` -> `Ich habe keinen Hund.` (I don't have a dog.)\n* `Das ist eine Katze.` -> `Das ist keine Katze.` (That is not a cat.)\n* `Ich esse Fleisch.` -> `Ich esse kein Fleisch.` (I don't eat meat.)\n**Important:** `kein` gets endings just like `ein`! It must be declined for case and gender.\n\n**2. Using `nicht` (not):**\n`nicht` is an **adverb**. It is used to negate almost everything else.\n* **Verbs:** `Ich schlafe.` -> `Ich schlafe nicht.` (It usually comes after the verb).\n* **Adjectives:** `Das Auto ist neu.` -> `Das Auto ist nicht neu.`\n* **Adverbs:** `Er fährt schnell.` -> `Er fährt nicht schnell.`\n* **Specific Nouns (with 'der', 'mein', etc.):** `Das ist nicht mein Auto.`\n* **Prepositional Phrases:** `Ich komme nicht aus England.`";V016;N009,N010;G007;;Day 7;35;3;"You can correctly choose between 'nicht' and 'kein' and place them correctly in a sentence.";If you can replace 'not' with 'not a/an' in the English sentence, you almost always need `kein`. If not, you need `nicht`. This simple test works most of the time.;In the Berlin dialect, `nicht` is often pronounced and written as `nich` or `nicht`. You might hear ""Ick wees nich"" instead of ""Ich weiß nicht"".;`Kein` is a 'negative article' and behaves like one. `Nicht` is an adverb and behaves differently. Understanding this grammatical distinction is the key to mastering negation.;You now have the power to disagree, refuse, and correct information. Your communication skills just doubled in flexibility.
9;Irregular Verbs;Verbs That Break the Rules;While most verbs are regular, many of the most common ones are 'strong' or irregular. They often change their stem vowel in the present tense. Learning them by heart is crucial because you will see and use them constantly.;"**80/20 Focus:** Master `sprechen` (to speak), `sehen` (to see), `lesen` (to read), `fahren` (to drive/go), `geben` (to give), and `nehmen` (to take). These are incredibly common.\n\n**The Vowel Change Pattern:**\nThe irregularity usually only happens in the **`du`** and **`er/sie/es`** forms. The other forms are often regular!\n\n**1. Pattern e -> i:**\n| Infinitive | du-form | er/sie/es-form |\n|---|---|---|\n| sprechen | du sprichst | er spricht |\n| geben | du gibst | er gibt |\n| helfen | du hilfst | er hilft |\n| nehmen | du nimmst | er nimmt | (also has consonant change)\n\n**2. Pattern e -> ie:**\n| Infinitive | du-form | er/sie/es-form |\n|---|---|---|\n| sehen | du siehst | er sieht |\n| lesen | du liest | er liest |\n\n**3. Pattern a -> ä (Umlaut):**\n| Infinitive | du-form | er/sie/es-form |\n|---|---|---|\n| fahren | du fährst | er fährt |\n| schlafen | du schläfst | er schläft |\n| waschen | du wäschst | er wäscht |";V011,V017;N009;G009;;Day 4;35;3;"You can conjugate the most common irregular verbs for all pronouns, especially the 'du' and 'er/sie/es' forms.";The vowel change only applies to `du` and `er/sie/es`. Think of them as a rebellious pair that likes to be different. The `wir`, `ihr`, and `sie/Sie` forms almost always follow the regular pattern.;Many of these vowel changes in German have echoes in English. For example, the past tense of 'give' is 'gave', showing a similar historical vowel shift.;Don't get discouraged! The number of irregular verbs is limited, and they are so common that you'll learn them through pure repetition. You don't need to 'study' them as much as 'use' them.;This is a perfect example of the 80/20 rule. These few dozen irregular verbs make up a huge percentage of daily verb usage.
10;Modal Verbs I;Ability, Desire, and Politeness;Modal verbs (`können`, `wollen`, `müssen`, etc.) are helper verbs that change the meaning of another verb. They express ability, desire, or obligation. They are incredibly powerful and common.;"**80/20 Focus:** Learn `können` (can), `wollen` (to want), and the polite form `möchten` (would like). They cover most situations of ability and desire.\n\n**The Sentence Structure:**\nModal verbs have a fixed sentence structure:\n1. The **modal verb** is conjugated and goes in **Position 2**.\n2. The **main verb** goes to the **very end** of the sentence in its infinitive form.\n* Example: `Ich kann gut singen.` (I can sing well.)\n\n**Conjugation (they are irregular!):**\nA key feature of modal verbs is that the `ich` and `er/sie/es` forms are identical.\n| Verb | ich-form | er/sie/es-form |\n|---|---|---|\n| können | ich **kann** | er **kann** |\n| wollen | ich **will** | er **will** |\n| möchten | ich **möchte** | er **möchte** |\n\n**Politeness is Key: `wollen` vs. `möchten`**\n`Ich will` can sound childish or demanding ('I want!'). It's often more polite to use `Ich möchte...` ('I would like...').\n* In a restaurant: `Ich möchte einen Kaffee, bitte.` (Polite)\n* With a friend: `Ich will heute Abend ins Kino gehen.` (Okay, expresses strong desire)";V023,V024,V046;;G010;;Day 5;35;3;"You can form a sentence using 'können', 'wollen', or 'möchten' with the second verb correctly at the end, and explain when to use 'möchten' for politeness.";The main verb gets kicked to the end of the sentence. Imagine the modal verb is a VIP that needs the second spot, so the other verb has to go to the back of the line.;The English word 'can' is also a modal verb and follows a similar pattern: ""I can **go**."" The main verb 'go' is also in its base form. The two languages are closely related!;`möchten` is technically the subjunctive (past) form of `mögen` (to like). Using this 'unreal' form is what makes it sound more polite and less direct.;With modal verbs, you can now express nuances like ability, desire, and politeness. Your communication is becoming much more sophisticated.
11;Possessive Articles;My, Your, His, Her;Time to claim ownership! Possessive articles (`my`, `your`, etc.) are essential for talking about your family, your things, and your life. They behave very much like the indefinite article 'ein' and must be declined.;"**80/20 Focus:** Master `mein` (my) and `dein` (your, informal) in the Nominative and Accusative cases. This covers 90% of what you'll talk about initially.\n\n**1. The Possessive Articles:**\n`ich` -> `mein` | `wir` -> `unser`\n`du` -> `dein` | `ihr` -> `euer`\n`er/es` -> `sein` (his/its) | `sie/Sie` -> `ihr`/`Ihr` (their/your formal)\n`sie` -> `ihr` (her)\n\n**2. Declension: It follows `ein`!**\nThe endings for possessive articles are exactly the same as for `ein` and `kein`.\n| Case | Masculine | Feminine | Neuter | Plural |\n|---|---|---|---|---|\n| Nom. | mein Hund | mein**e** Katze | mein Buch | mein**e** Bücher|\n| Acc. | mein**en** Hund | mein**e** Katze | mein Buch | mein**e** Bücher|\n\n**Example Sentences:**\n* `Das ist mein Bruder.` (Nom, masc)\n* `Siehst du meine Tasche?` (Acc, fem)\n* `Er hat seinen Schlüssel verloren.` (Acc, masc)";V021,V022;N011,N012;G012;;Day 3, 6;35;3;"You can use 'mein' and 'dein' correctly in nominative and accusative sentences, with the right endings for gender.";The ending on the possessive article depends on the gender/case of the noun it describes, NOT the gender of the owner. Her dog is `ihr Hund`, not `ihre Hund`.;The word `euer` (your plural) is tricky. When it gets an ending, it often drops the middle 'e': `eure Tasche` (your bag).;`Ihr/ihr` is a tricky one. It can mean 'her', 'their', or 'your (formal)'. The capitalization and context are your only clues. Don't worry, even Germans get confused sometimes if the context isn't clear!;Being able to talk about what belongs to you (`mein Haus`) or others (`sein Auto`) makes your language much more personal and descriptive.
