day;theme;title;introduction;main_content;vocabulary_focus;noun_focus;grammar_focus;grammar_data_focus;review_content;estimated_time;difficulty_level;success_criteria;hints;fun_facts;cultural_highlight;motivational_note
12;The Dative Case;The Indirect Object;Welcome to your third case! The Dative case is typically used for the indirect object – the person or thing that *receives* the direct object. It answers the question, ""To whom?"" (`Wem?`) or ""For whom?"".;"**80/20 Focus:** Learn the article changes and recognize the dative as the 'receiver' in sentences with `geben` (to give), `schenken` (to gift), and `zeigen` (to show). Also learn the key dative verb `helfen` (to help).\n\n**1. Dative Case Declension:**\nThis time, all articles change. This is a big step!\n| Gender | Nominative | Dative | Example |\n|---|---|---|---|\n| Masculine | der / ein | **dem / einem** | Ich gebe **dem Mann** ein Buch.|\n| Feminine | die / eine | **der / einer** | Ich helfe **der Frau**. |\n| Neuter | das / ein | **dem / einem** | Das Auto gehört **dem Kind**.|\n| Plural | die / - | **den / -** (+n) | Ich spiele mit **den Kindern**.|\n\n**2. Verbs that Always Take Dative:**\nSome verbs' objects are always in the Dative case.\n* `helfen` (to help): `Kannst du mir helfen?` (`mir` is dative 'me')\n* `danken` (to thank): `Ich danke Ihnen.` (`Ihnen` is dative 'you' formal)\n* `gefallen` (to be pleasing to): `Das Kleid gefällt mir.` (The dress pleases me -> I like the dress.)\n* `schmecken` (to taste good to): `Die Pizza schmeckt uns.` (The pizza tastes good to us.)";V025,V026;N002,N003;G016;;Day 6;35;4;"You can identify the dative noun in a sentence, know the correct article changes, and use the verb 'helfen' with a dative pronoun.";Chant the dative articles: `dem, der, dem, den... plus n`. The feminine `die` becomes `der`, which is a common trap!;'Mir gefällt...' is a very common way to say you like something visually, like clothes or a city. 'Es schmeckt mir' is the standard way to say something tastes good.;In a German sentence with both an accusative and a dative object, the dative object usually comes first if it's a pronoun: `Ich gebe es (Acc) dir (Dat).` vs. `Ich gebe dem Mann (Dat) das Buch (Acc).` This is an advanced topic, but good to know.;This is a major milestone. Understanding the dative case is essential for forming more complex and natural-sounding sentences. It separates the beginner from the intermediate learner.
13;Dative Prepositions;Prepositions that Demand Dative;Some prepositions are bullies. They don't care about the rest of the sentence; they ALWAYS demand the Dative case for the noun that follows them. Memorizing them is a direct path to using the Dative correctly.;"**80/20 Focus:** Memorize `mit` (with), `nach` (to/after), `von` (from), and `zu` (to). These are used constantly in daily speech and are almost guaranteed to appear on an A1 test.\n\n**The Core Dative Prepositions:**\n* `aus` - from, out of (origin)\n* `bei` - at, near, with (at someone's place)\n* `mit` - with, by (means of transport)\n* `nach` - to (cities/countries), after (time)\n* `seit` - since, for (a period of time continuing to now)\n* `von` - from, of\n* `zu` - to (people, places, direction)\n* `gegenüber` - opposite\n\n**How they work:**\nIf you see one of these words, the noun phrase that follows **must** be in the Dative case.\n* `Ich spreche mit dem Mann.` (I'm speaking with the man.)\n* `Er kommt aus der Schweiz.` (He comes from Switzerland.)\n* `Wir fahren zu meinen Eltern.` (We are driving to my parents.)\n\n**Contractions:** `zu + dem` -> `zum`; `zu + der` -> `zur`; `von + dem` -> `vom`";V032,V033,V034;;G017;;Day 12;30;4;"You can use 'mit', 'nach', 'von', and 'zu' correctly with a dative article and form contractions like 'zum' and 'zur'.";Learn the prepositions to the tune of the 'Blue Danube Waltz': `aus, bei, mit, nach, seit, von, zu` - they always take the dative, ooh ooh ooh!;The German word `Gift` means 'poison', not 'gift'! The word for a gift/present is `das Geschenk`.;`nach` is used for going to cities and countries without an article (`nach Deutschland`). `zu` is used for going to people or specific buildings (`zum Supermarkt`). `in` is used when you're going *inside* something.;This is a fantastic shortcut. By memorizing this small list of words, you know for sure you need to use the Dative case. No guesswork required!
14;Separable Prefix Verbs;Verbs That Split in Two;Some German verbs can be split in two! The prefix breaks off and goes to the end of the sentence. This seems strange at first but is a very common and logical pattern in German that allows for the creation of many new verbs.;"**80/20 Focus:** Learn the pattern with high-frequency verbs: `anrufen` (to call up), `einkaufen` (to shop), and `aufstehen` (to get up). Recognizing this pattern is key.\n\n**The Structure:**\n1. The verb stem is conjugated and stays in its normal position (usually Position 2).\n2. The prefix goes to the very **end** of the clause.\n\n* **`anrufen`** -> `Ich rufe dich morgen an.` (I will call you tomorrow.)\n* **`einkaufen`** -> `Sie kauft im Supermarkt ein.` (She is shopping in the supermarket.)\n* **`fernsehen`** -> `Er sieht jeden Abend fern.` (He watches TV every evening.)\n\n**Common Separable Prefixes:**\n* `an-` (at, on) -> `ankommen` (to arrive)\n* `auf-` (up, open) -> `aufmachen` (to open)\n* `aus-` (out) -> `aussehen` (to look, appear)\n* `ein-` (in, into) -> `einladen` (to invite)\n* `mit-` (with, along) -> `mitkommen` (to come along)\n* `vor-` (before, forward) -> `vorlesen` (to read out loud)";V027,V028,V029;;G015;;Day 5;30;3;"You can form a sentence with a separable verb, putting the prefix at the end, and recognize common separable prefixes.";The prefix is like a boomerang. You say the main part of the verb, but you throw the prefix to the end of the sentence.;When used with a modal verb (`können`, `müssen`...), the separable verb comes back together at the end! `Ich will dich anrufen.` (I want to call you.) The modal verb boots the *entire* re-joined verb to the end.;The prefix often changes the verb's meaning in a logical way. `kaufen` is 'to buy', but `ein-kaufen` is 'to do the shopping'. `sehen` is 'to see', but `fern-sehen` is 'to watch TV' (literally 'far-see').;This might feel like the strangest rule yet, but it's a core part of German. Once you get the rhythm of throwing the prefix to the end, it becomes second nature.
15;The Perfekt Tense with 'haben';How to Talk About the Past;How do you talk about what you did yesterday? In spoken German, you almost always use the 'Perfekt' tense. It's formed with a helping verb (`haben` or `sein`) and a past participle.;"**80/20 Focus:** Learn the structure and how to form the past participle for regular verbs. This will let you talk about a huge range of past actions.\n\n**1. The Structure (with `haben`):**\nThis is just like the modal verb structure!\n1. The helping verb `haben` is conjugated and goes in **Position 2**.\n2. The **Past Participle** (the actual past action) goes to the **end** of the sentence.\n* Example: `Ich habe Deutsch gelernt.` (I learned/have learned German.)\n\n**2. Making the Past Participle:**\n* **Regular (Weak) Verbs:** **`ge-` + verb stem + `-t`**\n  - `machen` -> `gemacht` (made/done) -> `Ich habe meine Hausaufgaben gemacht.`\n  - `spielen` -> `gespielt` (played) -> `Er hat Fußball gespielt.`\n* **Irregular (Strong) Verbs:** Often **`ge-` + stem (with vowel change) + `-en`**\n  - `sprechen` -> `gesprochen` (spoken) -> `Wir haben Deutsch gesprochen.`\n  - `trinken` -> `getrunken` (drunk) -> `Hast du den Kaffee getrunken?`\n\n**Watch Out! (No `ge-` prefix):**\n* Verbs ending in `-ieren`: `studieren` -> `studiert`. (`Ich habe studiert.`)\n* Verbs with inseparable prefixes (`be-`, `er-`, `ver-`...): `besuchen` -> `besucht`. (`Ich habe meine Oma besucht.`)\n";V030,V031;;G011,G013;;Day 9, 10;40;3;"You can form a past sentence for regular and common irregular verbs, and know the exceptions for verbs ending in '-ieren'.";Think of the past participle as a 'past-tense nugget'. The `ge-` prefix is the crunchy breading. `ge-lern-t`.;While English makes a distinction between 'I learned' (simple past) and 'I have learned' (present perfect), spoken German uses the Perfekt tense for almost all past actions. The simple past (`Präteritum`) is mostly for formal writing and stories.;This structure is incredibly useful. Once you learn a new past participle, you can immediately use it in conversation just by plugging it into the `Ich habe ... gemacht` formula.;You can now officially talk about your past! This opens up a whole new world of stories you can tell and understand.
16;Two-Way Prepositions;Location vs. Direction;These nine prepositions are chameleons. They can take EITHER the Accusative OR the Dative case, and the case you choose changes the meaning of the sentence from 'where to?' to 'where at?'. This is a core concept of German.;"**80/20 Focus:** Master the core concept with `in` (in), `an` (on/at), and `auf` (on top of). The question you ask determines the case.\n\n**The Golden Rule:**\n* Ask **`Wohin?`** (Where to?) -> implies **Direction/Movement** -> Use the **Accusative** case.\n* Ask **`Wo?`** (Where at?) -> implies static **Location/Position** -> Use the **Dative** case.\n\n**The Two-Way Prepositions:** `in`, `an` (at/on vertical surface), `auf` (on horizontal surface), `über` (over), `unter` (under), `vor` (in front of), `hinter` (behind), `neben` (next to), `zwischen` (between)\n\n**Detailed Example with `auf`:**\n* Direction (Accusative): `Ich lege das Buch auf den Tisch.` (I lay the book *onto* the table.) -> `Wohin?`\n* Location (Dative): `Das Buch liegt auf dem Tisch.` (The book is lying *on* the table.) -> `Wo?`\n\n**Common Contractions:**\n* Dative: `in + dem` -> `im`; `an + dem` -> `am`\n* Accusative: `in + das` -> `ins`; `an + das` -> `ans`";V007,V037,V038;;G018;;Day 6, 12;35;4;"You can explain the Wohin/Wo difference and correctly form sentences with 'in', 'an', and 'auf' in both Accusative and Dative.";Accusative has an 'A' for Action and movement. Dative is for a 'Dot on a map', a fixed location.;Germans are very precise about this. This rule eliminates ambiguity that exists in English. 'The boy is running in the house' could mean he is running around inside (Dative) or running from outside to inside (Accusative). German makes you choose!;These prepositions are extremely common. Mastering this concept is a sign that you are moving from a beginner to an intermediate level of thinking in German.;This is a tough concept, but it's incredibly logical. Once it 'clicks', you will feel like you've unlocked a secret level of German grammar.
17;The Perfekt Tense with 'sein';Verbs of Motion and Change;Some verbs don't use `haben` to form the past tense. They use `sein`. This happens with verbs that show movement from point A to point B, or a change of state (like waking up or being born).;"**80/20 Focus:** The most common verbs using `sein` are verbs of motion: `gehen` (to go), `fahren` (to drive/travel), and `fliegen` (to fly). Also, memorize the exceptions `sein` and `bleiben`.\n\n**The Rule:** Use `sein` (conjugated) instead of `haben` for certain verbs.\n\n**The Structure:**\n1. The helping verb `sein` is conjugated and goes in **Position 2**.\n2. The **Past Participle** goes to the **end** of the sentence.\n* Example: `Ich bin nach Hause gegangen.` (I went home.) **NOT** `ich habe gegangen`.\n\n**Verbs with `sein` Fall into 2 Categories (+ 2 exceptions):**\n1.  **A-to-B Motion:** `gehen` (gegangen), `fahren` (gefahren), `fliegen` (geflogen), `kommen` (gekommen), `reisen` (gereist), `laufen` (gelaufen)\n2.  **Change of State:** `aufstehen` (aufgestanden - to get up), `einschlafen` (eingeschlafen - to fall asleep), `wachsen` (gewachsen - to grow), `sterben` (gestorben - to die)\n3.  **The Exceptions:** `sein` (gewesen - to be) and `bleiben` (geblieben - to stay)";V017,V041,V042;;G012;;Day 15;30;4;"You know to say 'Ich bin gegangen' (not 'ich habe gegangen') and can list the types of verbs that use 'sein'.";If the verb involves your whole body moving from one location to another, you probably need `sein`. Think 'Go-verbs get Sein'.;`bleiben` (to stay) is a tricky one. Even though it implies a lack of motion, it's considered a 'change of state' (from moving to staying) and thus uses `sein`. `Ich bin zu Hause geblieben.` (I stayed at home.);The distinction between `haben` and `sein` in the past tense is a feature German shares with other languages like French (`être`) and Italian (`essere`).;You can now correctly describe journeys and changes. 'Yesterday I drove to the mountains' is a sentence you can now build perfectly.
18;Modal Verbs II;Obligation and Permission;Let's complete our set of essential modal verbs with `müssen` (must/to have to), `sollen` (should/ought to), and `dürfen` (may/to be allowed to).;"**80/20 Focus:** `müssen` (must) for necessity and `dürfen` (may) for permission are extremely common in daily rules and interactions.\n\n**The Structure:** Same as before! Modal in pos 2, infinitive at the end.\n\n**Conjugation (ich/er/sie/es forms are identical):**\n| Verb | ich-form | er/sie/es-form | Meaning |\n|---|---|---|---|\n| müssen | ich **muss** | er **muss** | must, have to (necessity) |\n| sollen | ich **soll** | er **soll** | should, supposed to (obligation/advice) |\n| dürfen | ich **darf** | er **darf** | may, be allowed to (permission) |\n\n**Crucial Difference in Negation:**\n* `nicht müssen` -> 'to **not have to**' (optional)\n  - `Du musst nicht abwaschen.` (You don't have to do the dishes.)\n* `nicht dürfen` -> 'to be **forbidden/must not**' (prohibition)\n  - `Du darfst hier nicht rauchen.` (You must not smoke here.)";V035,V036,V039;;G010;;Day 10;30;3;"You can use 'müssen', 'sollen', and 'dürfen', and explain the critical difference between 'nicht müssen' and 'nicht dürfen'.";`dürfen` has a `d` like a door. It's often about permission to go through the door. `müssen` sounds like 'must' - they both start with 'mu'. `sollen` sounds like 'should'.;A common question from a German parent to a child might be: `Musst du das machen oder sollst du das machen?` (Do you have to do that, or are you just supposed to do that?) to find out if the child is acting on their own or on someone else's orders.;In Germany, signs often use `dürfen` or its negation. `Hier dürfen Sie nicht parken!` (You may not park here!) is a common sign.;You can now understand and express rules, obligations, and permissions. This is crucial for navigating daily life in Germany.
19;The Imperative;Giving Commands and Instructions;Let's get bossy (or just helpful!). The imperative is the mood used to give commands, make suggestions, or provide instructions. It's very direct and useful, and each pronoun (`du`, `ihr`, `Sie`) has its own form.;"**80/20 Focus:** The informal `du` command is the most common and useful for everyday interactions. Master its formation, including for irregular verbs.\n\n**Forming Commands:**\n1.  **`du` (informal, to one person):**\n    * **Regular verbs:** Take the verb stem. That's it! `machen` -> `Mach!` `gehen` -> `Geh!`\n    * **Irregular verbs:** If the verb has a vowel change (e -> i/ie), keep the change. `geben` -> (du gibst) -> `Gib!` `lesen` -> (du liest) -> `Lies!`\n    * **Separable verbs:** The prefix goes to the end. `anrufen` -> `Ruf mich an!`\n2.  **`ihr` (informal, to a group):**\n    * This is the easiest one: just use the normal `ihr` form of the verb. `kommen` -> `Kommt!` `lesen` -> `Lest!`\n3.  **`Sie` (formal):**\n    * Flip the verb and pronoun from the normal statement. `kommen` -> `Kommen Sie!` `lesen` -> `Lesen Sie!`\n\n**Always add `bitte` (please) to be polite!** `Geben Sie mir bitte das Salz.` (Please give me the salt.)";V039,V040;;G019;;Day 9;25;3;"You can correctly form a command for 'du', 'ihr', and 'Sie' for both regular and common irregular verbs.";The `du` command is a 'short-cut' command. It's the shortest form, so you drop the pronoun and the `-st` ending.;The most famous command in German pop culture might be from the detective show 'Derrick', whose catchphrase was `Harry, hol schon mal den Wagen!` (Harry, go get the car!).;Being able to give and understand simple commands is essential for everything from cooking with a friend (`Gib mir das Salz!`) to navigating (`Fahren Sie geradeaus!`).;You are now able to direct action, not just describe it. This is a powerful shift in your communication ability.
20;Coordinating Conjunctions;Connecting Sentences Simply;These small words are mighty. They connect two complete sentences (main clauses) without changing the word order of the second sentence. They are the simplest way to form longer, more complex thoughts.;"**80/20 Focus:** `und` (and), `aber` (but), and `oder` (or) are the three essential connectors you will use every day. Also learn `denn` as an alternative to `weil`.\n\n**The 'Position 0' Rule (ADUSO):**\nThe coordinating conjunctions are: `aber` (but), `denn` (because), `und` (and), `sondern` (but rather), `oder` (or).\nThey sit *between* two complete sentences and are considered to be in **'Position 0'**. This means the sentence that follows them still begins its own word count, starting with the subject in Position 1 and the verb in Position 2.\n\n**Example with `aber`:**\n* `Ich will ins Kino gehen,` (Sentence 1)\n* `aber` (Position 0)\n* `ich` (Pos 1) `habe` (Pos 2) `keine Zeit.` (Sentence 2)\n\n**`denn` vs. `weil`:**\nBoth mean 'because', but `denn` is a coordinator (V2 word order), while `weil` is a subordinator (verb-final).\n* `Ich lerne Deutsch, denn ich wohne in Deutschland.`\n* `Ich lerne Deutsch, weil ich in Deutschland wohne.`";V043,V044,V045;;G021;;Day 5;25;2;"You can connect two sentences with 'und', 'aber', or 'denn' while keeping the correct V2 word order in the second clause.";Remember the acronym **ADUSO**: `Aber, Denn, Und, Sondern, Oder`. These are 'zero-position' words and don't mess up your V2 sentence structure.;`sondern` means 'but rather' and is used only after a negative statement to provide a direct correction. `Er ist nicht alt, sondern jung.` (He is not old, but rather young.);Understanding conjunctions is the first step to moving beyond simple sentences and expressing more complex relationships between ideas.;Your sentences are becoming longer and more interesting! You can now express connections and contrasts in your thoughts.
21;Subordinating Conjunctions;The 'Verb-Kicker' Rule;Now for a new, powerful word order rule! When a clause is introduced by a 'subordinating' conjunction like `weil` (because) or `dass` (that), the conjugated verb gets kicked to the very end of its own clause.;"**80/20 Focus:** `weil` (because) and `dass` (that) are the two most important subordinating conjunctions to learn at A1. They allow you to explain reasons and report what someone thinks or says.\n\n**The Verb-Final Rule:**\nIn a dependent clause (a clause introduced by a word like `weil` or `dass`), the conjugated verb moves from Position 2 to the **very end** of that clause.\n\n**Example with `weil`:**\n* `Ich kann heute nicht kommen, weil ich arbeiten muss.` (I can't come today because I have to work.)\n  - Note: The modal verb `muss` is conjugated and goes to the end.\n\n**Example with `dass` (that):**\n* `Ich denke, dass Deutsch eine interessante Sprache ist.` (I think that German is an interesting language.)\n  - The verb `ist` is kicked to the end.\n\n**Common Subordinating Conjunctions for A1:**\n`weil` (because), `dass` (that), `ob` (if/whether), `wenn` (if/when)";V052,V053;;G023;;Day 5, 10;35;4;"You can create a sentence with 'weil' or 'dass' and correctly place the conjugated verb at the very end of the clause.";`weil` and `dass` are 'verb-kickers'. They literally boot the conjugated verb to the end of their own clause. If there's a modal verb, the modal verb gets kicked to the end.;This verb-final structure can lead to very long sentences where you have to wait right until the end to find out what the action actually is! It's a key feature of formal and academic German.;The word `dass` is spelled with a double 's', while the article `das` is spelled with one 's'. A common mistake is to mix them up. `dass` is a connector, `das` refers to a neuter noun.;This is a major step towards sounding truly German. Mastering the verb-final rule is a sign of an advanced A1 / early A2 learner.
22;Let's Eat!;Ordering Food and Drink;Time to use your German in a practical, delicious setting. We'll learn vocabulary for food and drink, and the key phrases for politely ordering in a café or restaurant.;"**80/20 Focus:** The phrases `Ich hätte gern...` (I would like to have...), `Ich möchte...` (I would like...), and `Ich nehme...` (I'll take...) are the most polite and universally accepted ways to order.\n\n**Key Vocabulary:**\n| German | English | Notes |\n|---|---|---|\n| die Speisekarte | menu | |\n| bestellen | to order | |\n| zahlen, bitte | to pay, please | |\n| Die Rechnung, bitte | The bill, please. | |\n| das Trinkgeld | tip | |\n| Zusammen oder getrennt? | Together or separate? | They will ask this when you want to pay.|\n\n**Example Dialogue:**\n* Waiter: `Hallo! Was darf es sein?` (Hello! What can it be?)\n* You: `Guten Tag. Ich hätte gern ein Bier und das Schnitzel mit Pommes, bitte.` (Good day. I'd like a beer and the schnitzel with fries, please.)\n* (Later...)\n* You: `Entschuldigung, wir möchten bitte zahlen.` (Excuse me, we would like to pay please.)\n* Waiter: `Gerne. Zusammen oder getrennt?` (Gladly. Together or separate?)";V046,V047;N156,N086,N462;G010;;Day 10;30;2;"You can politely order a drink and a meal, ask to pay, and understand the 'zusammen/getrennt' question.";`Ich nehme...` (I'll take...) is also very common and perfectly polite for ordering food. `Ich hätte gern...` is often considered the most polite.;The legal drinking age for beer and wine in Germany is 16, and 18 for spirits. It's much more integrated into daily life than in many other countries.;Tipping (`Trinkgeld`) is appreciated but not obligatory. Rounding up the bill by 5-10% is a common practice for good service. For a €18.50 bill, you might say `Machen Sie 20` (Make it 20).;You are now ready to survive in a German restaurant! This is a skill that makes travel and social life much more enjoyable.
23;Adjective Endings I;A First Look at a Tricky Topic;This is one of the most feared parts of German grammar. When an adjective comes *before* a noun (`the red bus`), it needs an ending. We will take a gentle first look at the simplest and most common pattern.;"**80/20 Focus:** Don't try to master all endings at once. Just learn to recognize the pattern after a **definite article** (`der/die/das`). This is the 'weak' declension and it's the simplest.\n\n**The Rule:** An adjective only gets an ending when it is **before** the noun it describes. `Das Auto ist schnell.` (No ending). `Das ist ein schnelles Auto.` (Ending required).\n\n**The 'Weak' Declension (after `der`, `die`, `das`...):**\nThis pattern is surprisingly simple:\n* In the **Nominative singular** (M, F, N) AND **Accusative singular** (F, N), the ending is **-e**.\n  * `der gut**e** Mann`\n  * `die schön**e** Frau`\n  * `das klein**e** Kind`\n* **Everywhere else** (Masc. Accusative, all Dative, all Plural), the ending is **-en**.\n  * Accusative: `Ich sehe den gut**en** Mann.`\n  * Dative: `Ich helfe dem gut**en** Mann.`\n  * Plural: `Die gut**en** Kinder spielen.`";V048,V049;N008;G022;;Day 3, 6, 12;40;5;"You can explain the difference in endings between 'der rote Bus' and 'den roten Bus' and know when an adjective does not get an ending.";After a 'strong' article word (`der`, `den`, `dem`...), which already shows the gender and case clearly, the adjective can be 'weak' and take a simple `-e` or `-en` ending.;Mark Twain famously wrote an essay called 'The Awful German Language' where he hilariously complained about adjective endings. You're not alone in finding them tricky!;This topic is usually where A2 begins. Understanding the basic principle now gives you a huge head start and helps you read German better, as you'll see these endings everywhere.;Don't panic! This is an advanced topic. For A1, the goal is recognition, not perfect production. You've got this.
