day;theme;title;introduction;main_content;vocabulary_focus;noun_focus;grammar_focus;grammar_data_focus;review_content;estimated_time;difficulty_level;success_criteria;hints;fun_facts;cultural_highlight;motivational_note
24;Comparative & Superlative;Bigger, Better, Faster;How do you compare things? German is very similar to English here. It uses `-er` for 'more ...' (comparative) and a special form with `am ...-sten` for 'the most ...' (superlative).;"**80/20 Focus:** Learn the basic pattern with `-er` and `am ...-sten`, and memorize the three main irregulars: `gut`, `viel`, and `gern`.\n\n**1. The Regular Pattern:**\n* **Base:** `schnell` (fast)\n* **Comparative (-er):** `schneller` (faster)\n* **Superlative (am ...-sten):** `am schnellsten` (the fastest)\nExample: `Mein Auto ist schnell, aber dein Auto ist schneller.` `Sein Auto ist am schnellsten.`\n\n**2. The Three Main Irregulars:**\n| Base | Comparative | Superlative |\n|---|---|---|\n| `gut` (good) | `besser` (better)| `am besten` (best)|\n| `viel` (much) | `mehr` (more) | `am meisten` (most)|\n| `gern` (gladly) | `lieber` (preferably) | `am liebsten` (favorite)|\n\n**3. Using `als` (than):**\nWhen making a direct comparison, use `als`.\n* `Er ist größer als ich.` (He is taller than me.)\n* `Ich trinke lieber Tee als Kaffee.` (I prefer to drink tea than coffee.)";V050,V051;;G023;;Day 23;30;3;"You can form the comparative and superlative of a regular adjective and use 'besser', 'lieber' and 'als' in correct comparison sentences.";The `-er` ending is just like English ('fastER', 'smallER'). For superlative, remember `am ...-sten` is like a sandwich: 'am' is the bread on the left, '-sten' is the bread on the right.;Many short, one-syllable adjectives also add an umlaut in the comparative/superlative. `alt` -> `älter`, `groß` -> `größer`, `jung` -> `jünger`.;Being able to say you like something (`gern`), prefer something (`lieber`), or like it the most (`am liebsten`) is a very common and natural way to express opinions in German.;You can now compare things and express preferences, making your conversations much more nuanced and interesting.
25;Hobbies & Free Time;What Do You Do for Fun?;Let's talk about something enjoyable! Learn to talk about your hobbies and what you like to do in your free time using the special German word `gern`.;"**80/20 Focus:** The most natural way to talk about liking an *activity* is to add `gern` after the verb. For liking a *thing*, use the verb `mögen`.\n\n**1. How to Express Likes:**\n* **For Actions (Verbs): Use `gern`**\n  The word `gern` comes right after the conjugated verb.\n  * `Ich lese gern.` (I like to read.)\n  * `Hörst du gern Musik?` (Do you like to listen to music?)\n  * `Wir reisen gern.` (We like to travel.)\n  * Remember the comparative forms: `gern -> lieber -> am liebsten`.\n\n* **For Things (Nouns): Use `mögen`**\n  The verb `mögen` (to like) is used when you like a specific thing. It's an irregular modal-like verb!\n  * `ich mag`, `du magst`, `er/sie/es mag`...\n  * `Ich mag Pizza.` (I like pizza.)\n  * `Magst du Hunde?` (Do you like dogs?)\n\n**Key Hobby Vocabulary:**\n`lesen`, `Musik hören`, `Sport machen`, `Freunde treffen`, `ins Kino gehen`, `kochen`, `reisen`, `schwimmen`, `wandern` (to hike)";V054,V055;N015,N016;G023;;Day 24;30;2;"You can say at least two hobbies you like using 'gern' and one thing you like using 'mögen', and ask others about their hobbies.";Think of `gern` as adding a 'happy face' 😊 to a verb. `Ich spiele.` (I play.) -> `Ich spiele gern.` (I *like* to play.);Germany has over 600,000 registered clubs (`Vereine`). There are clubs for everything from soccer (`Fußballverein`) and choir (`Gesangsverein`) to breeding rabbits (`Kaninchenzüchterverein`).;Joining a `Verein` is a huge part of social life in Germany and a fantastic way for newcomers to meet people with similar interests.;Talking about your hobbies is a great way to find common ground and make new friends. This lesson is key to social conversations!
26;Dates & Ordinal Numbers;First, Second, Third...;How to say your birthday or talk about the date. Ordinal numbers (1st, 2nd, 3rd) are simple once you know the two patterns, and are essential for making appointments.;"**80/20 Focus:** Learn the pattern for 1-19 (`-te`) and the pattern for 20+ (`-ste`). Master how to state a date using `am ...-ten`.\n\n**1. The Rule for Ordinal Numbers:**\n* **1-19:** Add **`-te`** to the number. (e.g., `vierte`, `zehnte`)\n  * *Exceptions:* `erste` (1st), `dritte` (3rd), `siebte` (7th), `achte` (8th)\n* **20+:** Add **`-ste`** to the number. (e.g., `zwanzigste`, `dreißigste`, `hundertste`)\n\n**2. How to Say the Date:**\n* **To state what the date IS:** Use nominative `der` + ordinal + `-e`.\n  - `Heute ist der erste April.` (Today is the first of April.)\n* **To say something happens ON a date:** Use `am` (an + dem) + ordinal + `-en`.\n  - `Ich habe am zwanzigsten Mai Geburtstag.` (My birthday is on the 20th of May.)\n  - `Das Treffen ist am siebten Januar.` (The meeting is on the seventh of January.)\n\n**Asking the date:**\n* `Der Wievielte ist heute?` (What is the date today? Lit: 'The how-many-eth is it today?')";V056,V057;;G025;;Day 10;25;3;"You can state today's date and say your birthday in a full German sentence using 'am' and the correct ordinal number ending.";The `-te` ending for numbers up to 19 is like the 'th' in English. The exceptions `erste` and `dritte` sound a bit like 'first' and 'third'.;In German, dates are always written in Day.Month.Year format. So 12.07.2025 is July 12th, not December 7th. A very common point of confusion for Americans!;`Der Wievielte ist heute?` is a unique German construction. `wieviel` (how much/many) is combined with the ordinal ending `-te` to create a new question word.;You can now make appointments, understand deadlines, and most importantly, tell people when your birthday is so they can get you a `Geschenk`!
27;Giving Directions;How Do I Get There?;Combine your knowledge of commands, prepositions, and places to ask for and give simple directions. This is an incredibly practical skill for navigating any German-speaking city.;"**80/20 Focus:** Master `links` (left), `rechts` (right), and `geradeaus` (straight ahead). These three words combined with simple commands will get you almost anywhere.\n\n**1. Asking for Directions:**\n* `Entschuldigung, wie komme ich zum Bahnhof, bitte?` (Excuse me, how do I get to the train station, please?)\n* `Entschuldigung, wo ist die nächste Apotheke?` (Excuse me, where is the next pharmacy?)\n\n**2. Giving Directions (using the Imperative):**\n* `Gehen Sie immer geradeaus.` (Go straight ahead.)\n* `Biegen Sie an der Ampel links ab.` (Turn left at the traffic light.) (`abbiegen` is separable!)\n* `Nehmen Sie die zweite Straße rechts.` (Take the second street on the right.)\n\n**3. Useful Phrases:**\n* `auf der linken Seite` (on the left side)\n* `auf der rechten Seite` (on the right side)\n* `an der Ecke` (at the corner)\n* `gegenüber von` (opposite of)\n* `bis zur Kreuzung` (until the intersection)";V058,V059;N017,N018;G019;;Day 19, 18;30;3;"You can guide someone left, right, and straight ahead to a location using imperative forms and prepositions.";`links` and 'left' both start with 'L'. For `rechts`, think 'right and correct'. `geradeaus` has 'grade' in it, like a road grade you drive on.;The little green and red men on pedestrian traffic lights in Germany are called `Ampelmännchen` (little traffic light men). The design from former East Germany is particularly famous and is now a beloved cultural icon.;Even in the age of GPS, knowing how to ask for and understand directions is a vital skill. It can save you when your phone battery dies and is a great way to interact with locals.;You are now self-sufficient! You can navigate a German city on your own. What a fantastic feeling of independence.
28;Making Plans;Let's Meet Up!;Time to put it all together and make plans with friends. This combines time, activities, questions, and modal verbs into a real-life conversation that is typical for A1/A2 level.;"**80/20 Focus:** The key phrases `Hast du Zeit?` (Do you have time?), `Wollen wir...?` (Do we want to...?), `Was machen wir?` (What are we doing?), and `Wann treffen wir uns?` (When do we meet?) are the foundation of making plans.\n\n**Example Dialogue:**\n* **A:** `Hallo Anna! Hast du am Samstag Zeit?` (Hello Anna! Do you have time on Saturday?)\n* **B:** `Hallo Tom! Ja, am Abend habe ich Zeit. Hast du eine Idee?` (Hello Tom! Yes, in the evening I have time. Do you have an idea?)\n* **A:** `Super! Wollen wir ins Kino gehen? Es gibt einen neuen Film.` (Great! Do we want to go to the cinema? There is a new film.)\n* **B:** `Ja, gern! Wann und wo treffen wir uns?` (Yes, gladly! When and where do we meet?)\n* **A:** `Vielleicht um 20 Uhr vor dem Kino?` (Maybe at 8 PM in front of the cinema?)\n* **B:** `Das passt perfekt. Bis Samstag!` (That fits perfectly. See you Saturday!)\n\n**Useful Vocabulary:**\n`vorschlagen` (to suggest), `sich treffen` (to meet up), `eine Idee haben` (to have an idea), `passt das?` (does that work?), `Lust haben auf` (to be in the mood for)";V060,V061;;G010,G015;;Day 26, 27;30;3;"You can arrange a time and place to meet a friend to do a specific activity, and suggest an alternative.";To propose an activity, use `können` (We can...) or `Wollen wir...?` (Do we want to...?). To state a firm plan, just use the present tense: `Wir treffen uns...` (We are meeting...);Punctuality is not just a stereotype; it's highly valued in German culture. For casual plans with friends, being 5-10 minutes late is often fine (the 'akademisches Viertel' or academic quarter), but for formal appointments, on time means 5 minutes early.;Being able to make plans is the key to building a social life. This lesson transitions you from a pure 'learner' to someone who can actively use the language to create experiences.;Look at how much you've learned! You're combining questions, times, dates, modals, and places all into one single, practical conversation.
29;Personal Correspondence;Writing a Simple E-Mail;Let's apply your skills to written communication. Writing a short, informal e-mail to a friend uses many of the same structures we've learned, but with specific opening and closing formulas that are important to get right.;"**80/20 Focus:** Master a simple opening like `Liebe/r...` and a closing like `Viele Grüße`. This will cover most informal e-mail situations.\n\n**Structure of an Informal E-Mail:**\n1.  **Opening Salutation:**\n    * `Liebe Anna,` (Dear Anna, - for a female)\n    * `Lieber Thomas,` (Dear Thomas, - for a male)\n    * `Hallo zusammen,` (Hello everyone, - for a group)\n    * **Watch Out!** The word after the salutation is **not capitalized!**\n2.  **The Body of the E-mail:**\n    This is where you make your plan or ask your question.\n    `vielen Dank für deine E-Mail. Mir geht es gut. Wie geht es dir?\n    Ich wollte fragen, ob du am Freitag Zeit hast. Wir könnten ins Museum gehen. Hast du Lust?`\n3.  **Closing Line (Optional):**\n    `Ich freue mich auf deine Antwort.` (I look forward to your answer.)\n4.  **Closing Salutation (no comma after!):**\n    * `Viele Grüße` (Many greetings)\n    * `Liebe Grüße` (Kind regards, lit. 'love greetings')\n    * `Bis bald` (See you soon)\n5.  **Your Name:**\n    `Dein Michael` (Your Michael - if you are male) or `Deine Maria`";N411,N491,N492;;G023,G024;;Day 28;25;3;"You can write a short, informal e-mail to a friend suggesting a plan, using the correct salutations and formatting.";After the opening salutation (e.g., `Liebe Anna,`), the next word is always lowercase. Think of the salutation as Position 0 of the first sentence.;The abbreviation `LG` is very common in informal texts and emails and stands for `Liebe Grüße`. Likewise, `VG` stands for `Viele Grüße`.;Emails in a German business context are much more formal. They would start with `Sehr geehrte/r Herr/Frau...` and end with `Mit freundlichen Grüßen`. That's a B1/B2 topic!;Being able to write gives you time to think and form your sentences perfectly. It's a great way to practice without the pressure of a live conversation.
30;A1 Review & Next Steps;You Did It! What's Next?;Congratulations! You have covered all the core concepts of the A1 level. Today is for reviewing the key pillars of your knowledge, consolidating what you've learned, and looking ahead to what the next level, A2, has in store.;"**80/20 A1 Review - The 5 Pillars You Mastered:**\n1.  **Word Order:** You know the verb is in **Position 2** in main clauses (`V2-Regel`), in **Position 1** in Yes/No questions, and at the **End** of dependent clauses (`weil`, `dass`).\n2.  **The Case System:** You can identify the **Nominative** (subject - `der`), **Accusative** (direct object - `den`), and **Dative** (indirect object/receiver - `dem`) and know the definite article changes for each.\n3.  **The `Perfekt` Tense:** You can talk about the past in spoken German using `haben` or `sein` as a helper verb in Position 2 and a **past participle** at the end.\n4.  **Modal Verbs:** You can use `können`, `wollen`, `müssen`, `dürfen` to express ability, desire, and obligation, kicking the main verb to the end.\n5.  **Prepositions:** You know that some prepositions always demand the Accusative (`für`), some always demand the Dative (`mit`), and some (`Two-Way` like `in`) depend on location (Dative) vs. direction (Accusative).\n\n**Looking Ahead to A2:**\nAt the A2 level, you will build on this foundation by learning:\n* More complex sentence structures (Genitive case, relative clauses)\n* More tenses (Simple Past/Präteritum, Future I)\n* A much deeper dive into adjective endings\n* Reflexive & passive verbs";;;;;All previous days;45;4;"You can confidently identify and explain the 5 pillars of A1 German grammar and feel prepared for what comes next.";The journey from A1 to B1 is often considered the hardest part. The journey from B1 to C1 is about refinement and fluency. You've just finished the first, most important climb.;The levels A1, A2, B1, B2, C1, C2 are part of the Common European Framework of Reference for Languages (CEFR